{"apiVersion":"flowguard.gate/v1alpha1","kind":"GateDecision","authorityProfile":"advisory","mappingVersion":"flowguard.gate-mapping/v1alpha1","action":"commit","bindingDigest":"sha256:ab04c9ce7dc1b6711e5dc5c83c6f74aea334ddcfe9ae7ec8f010b5899754f15b","frozenObligationsDigest":"sha256:749e304af3bd07a158b98f721b337efbff05d78cd5f7e22462c46376436af701","decision":"ALLOW","qualification":"eligible","gaps":[],"report":{"uri":"artifact://flowguard/b20ef4f68e1a1867035539d738f3526a718f64a2dc838cae7e8b8059238014eb","digest":"sha256:b20ef4f68e1a1867035539d738f3526a718f64a2dc838cae7e8b8059238014eb","mediaType":"application/json"},"upstreamReports":[{"uri":"artifact://fixture/report","digest":"sha256:b19285743bd120680768bf203a7eeaa5824f4ce07d04816fa147ec424ecc670b","mediaType":"application/json"}]}